model,title,price,rating,reviews,availability
table,"DlandHome 63 inches X-Large Computer Desk, Composite Wood Board, Decent and Steady Home Office Desk/Workstation/Table, BS1-160TB Teak and Black Legs, 1 Pack",$249,4.6 out of 5 stars,"3,821 ratings",Currently unavailable.
table,"Flash Furniture Lars 30'' Round Wood Cocktail Table with 30'' and 42'' Columns, Natural",$113,4.5 out of 5 stars,"1,461 ratings",Currently unavailable.
table,Flash Furniture Billie Student Desk with Grey Top and Adjustable Height Black Pedestal Frame,,4.6 out of 5 stars,631 ratings,Currently unavailable.
table,"Signature Design by Ashley Clare View Sofa with Cushion, Beige & Barn Cove Rectangular Cocktail Table, Brown",,Previous page,,Currently unavailable.
table,"WoodShine Mid Century Modern Mini-Swing Wooden Coffee/Tea Table, Japanese Low Floor Desk, Real Solid Wood Side Tables with Storage for Home Living Room,Office,Length of 31.50 inches,Natural",$122,4.5 out of 5 stars,374 ratings,Currently unavailable.
table,"Furinno Efficient Home Laptop Notebook Computer Desk with Square Shelves, Black/Grey",$32.95,4.2 out of 5 stars,"26,261 ratings",Not Available
table,"Signature Design by Ashley Laflorn Traditional Chair Side End Table with 2 USB Ports & Outlets, Medium Brown",$174,4.6 out of 5 stars,"4,164 ratings",Currently unavailable.
table,"Nesting Coffee Tables for Living Room, Modern Round Sintered Stone Nesting Coffee Table Set of 2 with 0.2in Ultra Thin Slate Table Top and Sturdy Metal Frame (Black)",,4.2 out of 5 stars,5 ratings,Currently unavailable.
table,"UYIHOME Farmhouse Coffee Table and End Table Set, Oak Grey Wooden Living Room Furniture with Slats Base, Oak Grey",,4.2 out of 5 stars,3 ratings,Currently unavailable.
table,Flash Furniture Eve Black Sit to Stand Mobile Laptop Computer Desk,$66,4.1 out of 5 stars,"1,702 ratings",Temporarily out of stock.
table,"Winsome Skippy Snack Table, Dark Espresso",,4.6 out of 5 stars,"2,920 ratings",Currently unavailable.
table,"Modern Innovations Bedside Shelf for Bed, College Dorm Room, Bunk Bed Shelf for Top Bunk, Clip On Nightstand Tray with Cord and Cup Holder, Bunkbed Caddy for Table Storage (Navy)",,4.6 out of 5 stars,"5,504 ratings",Currently unavailable.
table,Table: Motorcycle Club Romance (Dragon Runners Book 4),$5.99,4.4 out of 5 stars,856 ratings,Not Available
table,"SDADI 2 Inches Carpet Wheels Mobile Standing Desk Stand Up Desk Height Adjustable Home Office Desk with Standing and Seating 2 Modes 3.0 Edition, Dark Grain S001WFDT",$184,4.4 out of 5 stars,"1,265 ratings",Currently unavailable.
table,"EUREKA ERGONOMIC Wing-Shaped Music Studio Desk 72"" Large Gaming Desk with Led Lights Keyboard Tray Tower Holder for Streaming",$99,3.8 out of 5 stars,4 ratings,Currently unavailable.
table,"Convenience Concepts Northfield Hall Console Table/Desk, Espresso",$109,4.4 out of 5 stars,"1,022 ratings",Currently unavailable.
table,"Furinno Basic 3-Tier Bookcase Storage Shelves, French Oak Grey & Andrey Set of 2 End Table/Side Table/Night Stand/Bedside Table with Bin Drawer, French Oak Grey",,4.2 out of 5 stars,"16,559 ratings",Currently unavailable.
table,"Lifetime Height Adjustable Craft Camping and Utility Folding Table, 4 Foot, 4'/48 x 24, White Granite",,4.7 out of 5 stars,"28,141 ratings",Currently unavailable.
table,"NETGEAR Wi-Fi Range Extender EX3700 - Coverage Up to 1000 Sq Ft and 15 Devices with AC750 Dual Band Wireless Signal Booster & Repeater (Up to 750Mbps Speed), and Compact Wall Plug Design",$69.00,3.8 out of 5 stars,"185,968 ratings",Not Available
table,"Humble Crew Kids Dry Erase Plastic Table and 2 Set, White Table & Grey Chairs & Grey/White Kids Book Rack Storage Bookshelf, 4 Tiers",,4.4 out of 5 stars,"5,154 ratings",Currently unavailable.
table,"無印良品 MUJI 18499441 Folding Table, 幅80×奥行50×高さ70cm, Pine",$51.65,4.5 out of 5 stars,"1,046 ratings",Not Available
table,"Iceberg 65333 IndestrucTable TOO 600S Folding Table, 30""x 96"", Platinum",,Previous page,,Currently unavailable.
table,"VECELO Corner Computer Desk 41 x 30 inches, Antique Brown & Modern Versatile Nightstands X-Design Side End Table Night Stand Storage Shelf with Bin Drawer for Living Room Bedroom, Set of 2 (Brown)",,4.6 out of 5 stars,"1,869 ratings",Currently unavailable.
table,"Humble Crew, White/Blue/Red Kids 2-in-1 Plastic Building Blocks-Compatible Activity Table and 2 Chairs Set, Square, Toddler & White/Primary Kids' Toy Storage Organizer with 12 Plastic Bins",,4.5 out of 5 stars,"2,428 ratings",Currently unavailable.
table,"Target Marketing Systems Udine 30-Inch Square Breakfast Table with Tapered Legs, Black",,4.1 out of 5 stars,114 ratings,Currently unavailable.
table,"Flash Furniture Billie Student Desk - Gray Open Front Metal School Desk - 24""W x 18""D Adjustable Height, Durable Desk for School or Remote Learning, Grey",,4.5 out of 5 stars,743 ratings,Temporarily out of stock.
table,"24KF Middle Century Upholstered Tufted Coffee Table with Velvet Padded Seat, Large Square Ottoman with Golden Metal Frame -Taupe",,4.6 out of 5 stars,351 ratings,Currently unavailable.
table,Flash Furniture Gael 6-Foot Rectangular Wood Folding Training / Seminar Table with Smooth Clear Coated Finished Top,,4.2 out of 5 stars,"1,033 ratings",Currently unavailable.
table,Flash Furniture Dunham 2.83-Foot Square Bi-Fold Brown Wood Grain Plastic Folding Table with Carrying Handle,,4.7 out of 5 stars,"6,234 ratings",Temporarily out of stock.
table,"Iceberg 1200 Series IndestrucTable Too Steel Legs Resin Folding Table, 300 lbs Capacity, 60"" Length x 24"" Width x 29"" Height, Charcoal",,4.1 out of 5 stars,65 ratings,Temporarily out of stock.
table,"Sauder North Avenue Coffee Table, Smoked Oak Finish & North Avenue Sofa Table, Smoked Oak Finish",$199,4.5 out of 5 stars,"5,594 ratings",Currently unavailable.
table,"Signature Design by Ashley Valebeck Farmhouse -Dining Room Server or Buffet, White & Brown & Valebeck Farmhouse Rectangular Extension Dining Table, Fits up to 8, White & Brown",$689,4.0 out of 5 stars,1 rating,Currently unavailable.
table,"Convenience Concepts Mission Console Table with Shelf, White",$79,4.6 out of 5 stars,924 ratings,Currently unavailable.
